{
  "contexts": [
    "universal-core",
    "narrative"
  ],
  "frames": [
    {
      "tokens": [
        {
          "id": "place_home",
          "type": "icon"
        },
        {
          "id": "action_conflict",
          "type": "icon"
        }
      ]
    }
  ],
  "pictiq": "1.1",
  "profile": "standalone-core-v0.1",
  "schema": "0.1"
}
